{
  "annotations": {
    "frontend": "drizzle-orm@0.45.3"
  },
  "generator": {
    "name": "esdb-orm-drizzle",
    "source": "examples/orm/user/schema/user.schema.ts",
    "version": "0.1.0"
  },
  "ir_version": "esdb.ir/v1",
  "queries": [
    {
      "cardinality": "changes",
      "kind": "delete",
      "name": "user.deleteById",
      "table": "user",
      "where": [
        {
          "column": "id",
          "op": "eq",
          "param": "id"
        }
      ]
    },
    {
      "cardinality": "one",
      "kind": "select",
      "name": "user.findByEmail",
      "table": "user",
      "where": [
        {
          "column": "email",
          "op": "eq",
          "param": "email"
        }
      ]
    },
    {
      "cardinality": "one",
      "kind": "select",
      "name": "user.findById",
      "table": "user",
      "where": [
        {
          "column": "id",
          "op": "eq",
          "param": "id"
        }
      ]
    },
    {
      "cardinality": "changes",
      "kind": "insert",
      "name": "user.insert",
      "table": "user",
      "values": [
        {
          "column": "id",
          "param": "id"
        },
        {
          "column": "name",
          "param": "name"
        },
        {
          "column": "email",
          "param": "email"
        },
        {
          "column": "createdAt",
          "param": "createdAt"
        }
      ]
    },
    {
      "cardinality": "many",
      "kind": "select",
      "limit": "limit",
      "name": "user.list",
      "offset": "offset",
      "order_by": [
        {
          "column": "id",
          "direction": "asc"
        }
      ],
      "table": "user"
    },
    {
      "cardinality": "changes",
      "kind": "update",
      "name": "user.updateName",
      "set": [
        {
          "column": "name",
          "param": "name"
        }
      ],
      "table": "user",
      "where": [
        {
          "column": "id",
          "op": "eq",
          "param": "id"
        }
      ]
    }
  ],
  "schema": {
    "dialect": "sqlite",
    "name": "user",
    "namespace": "esdb.orm.user"
  },
  "tables": [
    {
      "columns": [
        {
          "autoincrement": false,
          "name": "id",
          "nullable": false,
          "primary_key": true,
          "sql_name": "id",
          "type": "integer",
          "unique": false
        },
        {
          "autoincrement": false,
          "name": "name",
          "nullable": false,
          "primary_key": false,
          "sql_name": "name",
          "type": "text",
          "unique": false
        },
        {
          "autoincrement": false,
          "name": "email",
          "nullable": false,
          "primary_key": false,
          "sql_name": "email",
          "type": "text",
          "unique": true
        },
        {
          "autoincrement": false,
          "name": "createdAt",
          "nullable": false,
          "primary_key": false,
          "sql_name": "created_at",
          "type": "integer",
          "unique": false
        }
      ],
      "name": "user",
      "primary_key": [
        "id"
      ],
      "sql_name": "user",
      "uniques": [
        [
          "email"
        ]
      ]
    }
  ]
}
